{
  "$schema": "https://json-schema.org/draft/2020-12/schema",
  "description": "Rows a request may bring for the money template: { table: [row] }. Generated by scripts/gen-schemas.ts; do not edit.",
  "type": "object",
  "properties": {
    "transactions": {
      "type": "array",
      "items": {
        "type": "object",
        "properties": {
          "$key": {
            "type": "string",
            "minLength": 1,
            "description": "This row's name within the request, for $ref"
          },
          "date": {
            "type": "string"
          },
          "merchant": {
            "type": "string"
          },
          "category": {
            "type": "string",
            "enum": [
              "Salary",
              "Freelance",
              "Interest & dividends",
              "Other income",
              "Rent",
              "Groceries",
              "Eating out",
              "Travel",
              "Utilities",
              "Shopping",
              "Investments"
            ]
          },
          "amount": {
            "type": "integer",
            "minimum": -9007199254740991,
            "maximum": 9007199254740991
          }
        },
        "required": [
          "$key",
          "date",
          "merchant",
          "category",
          "amount"
        ],
        "additionalProperties": false
      }
    },
    "budgets": {
      "type": "array",
      "items": {
        "type": "object",
        "properties": {
          "$key": {
            "type": "string",
            "minLength": 1,
            "description": "This row's name within the request, for $ref"
          },
          "category": {
            "type": "string",
            "enum": [
              "Salary",
              "Freelance",
              "Interest & dividends",
              "Other income",
              "Rent",
              "Groceries",
              "Eating out",
              "Travel",
              "Utilities",
              "Shopping",
              "Investments"
            ]
          },
          "month": {
            "type": "string"
          },
          "limit_amount": {
            "type": "integer",
            "minimum": -9007199254740991,
            "maximum": 9007199254740991
          }
        },
        "required": [
          "$key",
          "category",
          "month",
          "limit_amount"
        ],
        "additionalProperties": false
      }
    },
    "holdings": {
      "type": "array",
      "items": {
        "type": "object",
        "properties": {
          "$key": {
            "type": "string",
            "minLength": 1,
            "description": "This row's name within the request, for $ref"
          },
          "name": {
            "type": "string"
          },
          "kind": {
            "type": "string",
            "enum": [
              "Equity funds",
              "Index funds",
              "Stocks",
              "Fixed deposits",
              "Gold",
              "PPF"
            ]
          },
          "value": {
            "type": "integer",
            "minimum": -9007199254740991,
            "maximum": 9007199254740991
          },
          "invested": {
            "type": "integer",
            "minimum": -9007199254740991,
            "maximum": 9007199254740991
          }
        },
        "required": [
          "$key",
          "name",
          "kind",
          "value",
          "invested"
        ],
        "additionalProperties": false
      }
    },
    "goals": {
      "type": "array",
      "items": {
        "type": "object",
        "properties": {
          "$key": {
            "type": "string",
            "minLength": 1,
            "description": "This row's name within the request, for $ref"
          },
          "goal": {
            "type": "string"
          },
          "saved": {
            "type": "integer",
            "minimum": -9007199254740991,
            "maximum": 9007199254740991
          },
          "target": {
            "type": "integer",
            "minimum": -9007199254740991,
            "maximum": 9007199254740991
          },
          "by": {
            "type": [
              "string",
              "null"
            ]
          }
        },
        "required": [
          "$key",
          "goal",
          "saved",
          "target"
        ],
        "additionalProperties": false
      }
    }
  },
  "additionalProperties": false
}
